<?xml version="1.0" encoding="utf-8"?>
<xs:schema attributeFormDefault="unqualified" elementFormDefault="qualified"
  xmlns:xs="http://www.w3.org/2001/XMLSchema">
  <xs:element name="login">
    <xs:complexType>
      <xs:sequence>
        <xs:element name="page">
          <xs:complexType>
            <xs:sequence>
              <xs:element name="logo" type="xs:string" />
              <xs:element name="decorative-image" type="xs:string" />
              <xs:element name="title" type="xs:string" />
              <xs:element name="description" type="xs:string" />
              <xs:element name="checkbox">
                <xs:complexType mixed="true">
                  <xs:sequence>
                    <xs:element maxOccurs="unbounded" name="a">
                      <xs:complexType>
                        <xs:simpleContent>
                          <xs:extension base="xs:string">
                            <xs:attribute name="href" type="xs:string" use="required" />
                          </xs:extension>
                        </xs:simpleContent>
                      </xs:complexType>
                    </xs:element>
                  </xs:sequence>
                </xs:complexType>
              </xs:element>
              <xs:element name="forgot-password">
                <xs:complexType>
                  <xs:sequence>
                    <xs:element name="a">
                      <xs:complexType>
                        <xs:simpleContent>
                          <xs:extension base="xs:string">
                            <xs:attribute name="href" type="xs:string" use="required" />
                          </xs:extension>
                        </xs:simpleContent>
                      </xs:complexType>
                    </xs:element>
                  </xs:sequence>
                </xs:complexType>
              </xs:element>
              <xs:element name="call-to-action">
                <xs:complexType mixed="true">
                  <xs:sequence>
                    <xs:element name="a">
                      <xs:complexType>
                        <xs:simpleContent>
                          <xs:extension base="xs:string">
                            <xs:attribute name="href" type="xs:string" use="required" />
                          </xs:extension>
                        </xs:simpleContent>
                      </xs:complexType>
                    </xs:element>
                  </xs:sequence>
                </xs:complexType>
              </xs:element>
            </xs:sequence>
          </xs:complexType>
        </xs:element>
      </xs:sequence>
    </xs:complexType>
  </xs:element>
</xs:schema>
