<?xml version="1.0" encoding="UTF-8"?>
<login xmlns:xsi="http://www.w3.org/2001/XMLSchema-instance"
  xsi:noNamespaceSchemaLocation="../../schema/login.xsd">
  <page>
    <logo>../../../assets/img/fhlc-logo.png</logo>
    <decorative-image>../../../assets/img/login.jpg</decorative-image>
    <title>Sign in to Account</title>
    <description>Enter your username and password</description>
    <checkbox> I have carefully read and fully agree to the <a href="../terms-conditions.php" target="_blank">Terms
      and Conditions</a> and <a href="../privacy-policy.php" target="_blank">Privacy Policy</a> of this website.</checkbox>
    <forgot-password>
      <a href="forgot-password.php">Forgot Password?</a>
    </forgot-password>
    <call-to-action>Don't have an account? <a href="register.php">Register now!</a></call-to-action>
  </page>
</login>
